Movie Title,Year of Realease,Genre,Movie Rating,Duration,Gross,Worldwide LT Gross,Metascore,Votes,Logline
King Kong,2005,"Action,Adventure,Drama",7.2,187,$218.08M,"$556,906,378",81,"422,691","A greedy film producer assembles a team of moviemakers and sets out for the infamous Skull Island, where they find more than just cannibalistic natives."
Puss in Boots,2011,"Animation,Adventure,Comedy",6.6,90,$149.26M,"$554,987,477",65,"159,431","An outlaw cat, his childhood egg-friend, and a seductive thief kitty set out in search for the eggs of the fabled Golden Goose to clear his name, restore his lost honor, and regain the trust of his mother and town."
Mei ren yu,2016,"Comedy,Drama,Fantasy",6.2,94,$3.23M,"$553,810,228",69,"9,374","Shan, a mermaid, is sent to assassinate Xuan, a developer who threatens the ecosystem of her race, but ends up falling in love with him instead."
Armageddon,1998,"Action,Adventure,Sci-Fi",6.7,151,$201.57M,"$553,709,788",42,"425,532","After discovering that an asteroid the size of Texas will impact Earth in less than a month, NASA recruits a misfit team of deep-core drillers to save the planet."
The Day After Tomorrow,2004,"Action,Adventure,Sci-Fi",6.4,124,$186.74M,"$552,639,571",47,"447,826","Jack Hall, paleoclimatologist, must make a daring trek from Washington, D.C. to New York City to reach his son, trapped in the cross-hairs of a sudden international storm which plunges the planet into a new Ice Age."
Ted,2012,Comedy,6.9,106,$218.82M,"$549,368,315",62,"612,897","John Bennett, a man whose childhood wish of bringing his teddy bear to life came true, now must decide between keeping the relationship with the bear, Ted or his girlfriend, Lori."
American Sniper,2014,"Action,Biography,Drama",7.3,133,$350.13M,"$547,459,020",72,"486,028","Navy S.E.A.L. sniper Chris Kyle's pinpoint accuracy saves countless lives on the battlefield and turns him into a legend. Back home with his family after four tours of duty, however, Chris finds that it is the war he can't leave behind."
Mission: Impossible II,2000,"Action,Adventure,Thriller",6.1,123,$215.41M,"$546,388,108",59,"342,535","IMF agent Ethan Hunt is sent to Sydney to find and destroy a genetically modified disease called ""Chimera""."
Tang ren jie tan an 2,2018,"Action,Comedy,Mystery",6.1,121,$1.98M,"$544,185,156",48,"2,693",Tang and Qin team up to solve a murder in New York's Chinatown.
X-Men: Apocalypse,2016,"Action,Adventure,Sci-Fi",6.9,144,$155.44M,"$543,934,105",52,"433,669","In the 1980s the X-Men must defeat an ancient all-powerful mutant, En Sabah Nur, who intends to thrive through bringing destruction to the world."
Sherlock Holmes: A Game of Shadows,2011,"Action,Adventure,Mystery",7.4,129,$186.85M,"$543,848,418",48,"453,910","Detective Sherlock Holmes is on the trail of criminal mastermind Professor Moriarty, who is carrying out a string of random crimes across Europe."
Despicable Me,2010,"Animation,Adventure,Comedy",7.6,95,$251.51M,"$543,157,985",72,"545,549","When a criminal mastermind uses a trio of orphan girls as pawns for a grand scheme, he finds their love is profoundly changing him for the better."
Cinderella,2015,"Adventure,Drama,Family",6.9,105,$201.15M,"$542,358,331",67,"177,525","When her father unexpectedly dies, young Ella finds herself at the mercy of her cruel stepmother and her scheming stepsisters. Never one to give up hope, Ella's fortunes begin to change after meeting a dashing stranger."
Madagascar,2005,"Animation,Adventure,Comedy",6.9,86,$193.60M,"$542,063,846",57,"402,909","A group of animals who have spent all their life in a New York zoo end up in the jungles of Madagascar, and must adjust to living in the wild."
World War Z,2013,"Action,Adventure,Horror",7.0,116,$202.36M,"$540,455,876",63,"662,743",Former United Nations employee Gerry Lane traverses the world in a race against time to stop a zombie pandemic that is toppling armies and governments and threatens to destroy humanity itself.
Brave,2012,"Animation,Adventure,Comedy",7.1,93,$237.28M,"$538,983,207",69,"410,413","Determined to make her own path in life, Princess Merida defies a custom that brings chaos to her kingdom. Granted one wish, Merida must rely on her bravery and her archery skills to undo a beastly curse."
The Empire Strikes Back,1980,"Action,Adventure,Fantasy",8.7,124,$290.48M,"$538,375,067",82,"1,280,836","After the Rebels are brutally overpowered by the Empire on the ice planet Hoth, Luke Skywalker begins Jedi training with Yoda, while his friends are pursued across the galaxy by Darth Vader and bounty hunter Boba Fett."
The Simpsons Movie,2007,"Animation,Adventure,Comedy",7.3,87,$183.14M,"$536,414,293",80,"330,377","After Homer pollutes the town's water supply, Springfield is encased in a gigantic dome by the EPA and the Simpsons are declared fugitives."
The Revenant,2015,"Action,Adventure,Drama",8.0,156,$183.64M,"$532,950,503",76,"796,927",A frontiersman on a fur trading expedition in the 1820s fights for survival after being mauled by a bear and left for dead by members of his own hunting team.
The Meg,2018,"Action,Horror,Sci-Fi",5.6,113,$143.01M,"$530,517,320",46,"171,428",A group of scientists exploring the Marianas Trench encounter the largest marine predator that has ever existed - the Megalodon.
Ralph Breaks the Internet,2018,"Animation,Adventure,Comedy",7.0,112,$201.09M,"$529,323,962",71,"160,624","Six years after the events of ""Wreck-It Ralph,"" Ralph and Vanellope, now friends, discover a wi-fi router in their arcade, leading them into a new adventure."
Hotel Transylvania 3: Summer Vacation,2018,"Animation,Adventure,Comedy",6.3,97,$167.51M,"$528,583,774",54,"74,177","Count Dracula and company participate in a cruise for sea-loving monsters, unaware that their boat is being commandeered by the monster-hating Van Helsing family."
The Boss Baby,2017,"Animation,Adventure,Comedy",6.3,97,$175.00M,"$527,965,936",50,"126,991","A suit-wearing, briefcase-carrying baby pairs up with his 7-year old brother to stop the dastardly plot of the CEO of Puppy Co."
Dunkirk,2017,"Action,Drama,History",7.8,106,$188.37M,"$527,016,307",94,"650,998","Allied soldiers from Belgium, the British Commonwealth and Empire, and France are surrounded by the German Army and evacuated during a fierce battle in World War II."
Godzilla,2014,"Action,Adventure,Sci-Fi",6.4,123,$200.68M,"$524,976,069",62,"413,560","The world is beset by the appearance of monstrous creatures, but one of them may be the only one who can save humanity."
How to Train Your Dragon: The Hidden World,2019,"Animation,Action,Adventure",7.4,104,$160.80M,"$524,580,403",71,"128,488","When Hiccup discovers Toothless isn't the only Night Fury, he must seek ""The Hidden World"", a secret Dragon Utopia before a hired tyrant named Grimmel finds it first."
Sherlock Holmes,2009,"Action,Adventure,Mystery",7.6,128,$209.03M,"$524,028,679",57,"631,723",Detective Sherlock Holmes and his stalwart partner Watson engage in a battle of wits and brawn with a nemesis whose plot is a threat to all of England.
Meet the Fockers,2004,"Comedy,Romance",6.3,115,$279.26M,"$522,657,936",41,"271,402",All hell breaks loose when the Byrnes family meets the Focker family for the first time.
WALL·E,2008,"Animation,Adventure,Family",8.4,98,$223.81M,"$521,311,890",95,"1,106,841","In the distant future, a small waste-collecting robot inadvertently embarks on a space journey that will ultimately decide the fate of mankind."
Kung Fu Panda 3,2016,"Animation,Action,Adventure",7.1,95,$143.53M,"$521,170,825",66,"158,944","Continuing his ""legendary adventures of awesomeness"", Po must face two hugely epic, but different threats: one supernatural and the other a little closer to home."
Terminator 2: Judgment Day,1991,"Action,Sci-Fi",8.6,137,$204.84M,"$520,881,154",75,"1,089,869","A cyborg, identical to the one who failed to kill Sarah Connor, must now protect her ten-year-old son John from a more advanced and powerful cyborg."
Ant-Man,2015,"Action,Adventure,Comedy",7.3,117,$180.20M,"$519,311,965",64,"660,728","Armed with a super-suit with the astonishing ability to shrink in scale but increase in strength, cat burglar Scott Lang must embrace his inner hero and help his mentor, Dr. Hank Pym, pull off a plan that will save the world."
The Grinch,2018,"Animation,Comedy,Family",6.3,85,$270.62M,"$512,858,819",51,"70,213",A grumpy Grinch plots to ruin Christmas for the village of Whoville.
Venom: Let There Be Carnage,2021,"Action,Adventure,Sci-Fi",5.9,97,$213.55M,"$506,863,592",49,"220,241","Eddie Brock attempts to reignite his career by interviewing serial killer Cletus Kasady, who becomes the host of the symbiote Carnage and escapes prison after a failed execution."
Ghost,1990,"Drama,Fantasy,Romance",7.1,127,$217.63M,"$505,703,557",52,"217,251","After a young man is murdered, his spirit stays behind to warn his lover of impending danger, with the help of a reluctant psychic."
Aladdin,1992,"Animation,Adventure,Comedy",8.0,90,$217.35M,"$504,050,219",86,"416,811",A kindhearted street urchin and a power-hungry Grand Vizier vie for a magic lamp that has the power to make their deepest wishes come true.
Rio 2,2014,"Animation,Adventure,Comedy",6.3,101,$131.54M,"$498,781,117",49,"90,925","It's a jungle out there for Blu, Jewel, and their three kids after they're hurtled from Rio de Janeiro to the wilds of the Amazon. As Blu tries to fit in, he goes beak-to-beak with the vengeful Nigel and meets his father-in-law."
Troy,2004,"Drama,History",7.3,163,$133.38M,"$497,409,852",56,"533,295","An adaptation of Homer's great epic, the film follows the assault on Troy by the united Greek forces and chronicles the fates of the men involved."
Toy Story 2,1999,"Animation,Adventure,Comedy",7.9,92,$245.85M,"$497,375,381",88,"578,177","When Woody is stolen by a toy collector, Buzz and his friends set out on a rescue mission to save Woody before he becomes a museum toy property with his roundup gang Jessie, Prospector, and Bullseye."
How to Train Your Dragon,2010,"Animation,Action,Adventure",8.1,98,$217.58M,"$494,879,471",75,"735,267","A hapless young Viking who aspires to hunt dragons becomes the unlikely friend of a young dragon himself, and learns there may be more to the creatures than he assumed."
Twister,1996,"Action,Adventure,Thriller",6.4,113,$241.72M,"$494,580,615",68,"196,834","Bill and Jo Harding, advanced storm chasers on the brink of divorce, must join together to create an advanced weather alert system by putting themselves in the cross-hairs of extremely violent tornadoes."
Oz the Great and Powerful,2013,"Adventure,Family,Fantasy",6.3,130,$234.91M,"$493,311,825",44,"208,389",A small-time magician is swept away to an enchanted land and is forced into a power struggle between three witches.
Clash of the Titans,2010,"Action,Adventure,Fantasy",5.8,106,$163.21M,"$493,214,993",39,"282,939","Perseus, a demigod and the son of Zeus, battles the minions of Hades and the Underworld in order to stop them from conquering Olympus and Earth."
Maleficent: Mistress of Evil,2019,"Adventure,Family,Fantasy",6.6,119,$113.93M,"$491,730,089",43,"105,066","Maleficent and her goddaughter Aurora begin to question the complex family ties that bind them as they are pulled in different directions by impending nuptials, unexpected allies, and dark new forces at play."
War for the Planet of the Apes,2017,"Action,Adventure,Drama",7.4,140,$146.88M,"$490,719,763",82,"256,597","After the apes suffer unimaginable losses, Caesar wrestles with his darker instincts and begins his own mythic quest to avenge his kind."
Shrek,2001,"Animation,Adventure,Comedy",7.9,90,$267.67M,"$488,351,320",84,"672,459","A mean lord exiles fairytale creatures to the swamp of a grumpy ogre, who must go on a quest and rescue a princess for the lord in order to get his land back."
Mr. & Mrs. Smith,2005,"Action,Comedy,Crime",6.5,120,$186.34M,"$487,287,646",55,"494,933",A bored married couple is surprised to learn that they are both assassins hired by competing agencies to kill each other.
Angels & Demons,2009,"Action,Mystery,Thriller",6.7,138,$133.38M,"$485,930,816",48,"293,394",Harvard symbologist Robert Langdon works with a nuclear physicist to solve a murder and prevent a terrorist act against the Vatican during one of the significant events within the church.
Teenage Mutant Ninja Turtles,2014,"Action,Adventure,Comedy",5.8,101,$191.20M,"$485,004,754",31,"211,216","When a kingpin threatens New York City, a group of mutated turtle warriors must emerge from the shadows to protect their home."
Bruce Almighty,2003,"Comedy,Fantasy",6.8,101,$242.83M,"$484,592,874",46,"403,001",A whiny news reporter is given the chance to step into God's shoes.
Rio,2011,"Animation,Adventure,Comedy",6.9,96,$143.62M,"$483,866,518",63,"227,834","When Blu, a domesticated macaw from small-town Minnesota, meets the fiercely independent Jewel, he takes off on an adventure to Rio de Janeiro with the bird of his dreams."
Saving Private Ryan,1998,"Drama,War",8.6,169,$216.54M,"$482,349,603",91,"1,377,916","Following the Normandy Landings, a group of U.S. soldiers go behind enemy lines to retrieve a paratrooper whose brothers have been killed in action."
Rise of the Planet of the Apes,2011,"Action,Drama,Sci-Fi",7.6,105,$176.76M,"$481,800,873",68,"527,898",A substance designed to help the brain repair itself gives advanced intelligence to a chimpanzee who leads an ape uprising.
Home Alone,1990,"Comedy,Family",7.7,103,$285.76M,"$476,684,675",63,"563,004",An eight-year-old troublemaker must protect his house from a pair of burglars when he is accidentally left home alone by his family during Christmas vacation.
Hotel Transylvania 2,2015,"Animation,Adventure,Comedy",6.6,89,$169.70M,"$475,186,706",44,"127,713","Dracula and his friends try to bring out the monster in his half human, half vampire grandson in order to keep Mavis from leaving the hotel."
Star Wars: Episode VI - Return of the Jedi,1983,"Action,Adventure,Fantasy",8.3,131,$309.13M,"$475,106,177",58,"1,045,754","After a daring mission to rescue Han Solo from Jabba the Hutt, the Rebels dispatch to Endor to destroy the second Death Star. Meanwhile, Luke struggles to help Darth Vader back from the dark side without falling into the Emperor's trap."
Charlie and the Chocolate Factory,2005,"Adventure,Comedy,Family",6.7,115,$206.46M,"$474,968,763",72,"478,381","A young boy wins a tour through the most magnificent chocolate factory in the world, led by the world's most unusual candy maker."
Indiana Jones and the Last Crusade,1989,"Action,Adventure",8.2,127,$197.17M,"$474,171,806",65,"750,474","In 1938, after his father Professor Henry Jones, Sr. goes missing while pursuing the Holy Grail, Professor Henry ""Indiana"" Jones, Jr. finds himself up against Adolf Hitler's Nazis again to stop them from obtaining its powers."
Jaws,1975,"Adventure,Thriller",8.1,124,$260.00M,"$474,141,300",87,"602,420","When a killer shark unleashes chaos on a beach community off Cape Cod, it's up to a local sheriff, a marine biologist, and an old seafarer to hunt the beast down."
San Andreas,2015,"Action,Adventure,Thriller",6.1,114,$155.19M,"$474,009,154",43,"237,412","In the aftermath of a massive earthquake in California, a rescue-chopper pilot makes a dangerous journey with his ex-wife across the state in order to rescue his daughter."
It Chapter Two,2019,"Drama,Fantasy,Horror",6.5,169,$211.59M,"$473,122,525",58,"262,024","Twenty-seven years after their first encounter with the terrifying Pennywise, the Losers Club have grown up and moved away, until a devastating phone call brings them back."
Wreck-It Ralph,2012,"Animation,Adventure,Comedy",7.7,101,$189.42M,"$471,222,889",72,"421,180","A video game villain wants to be a hero and sets out to fulfill his dream, but his quest brings havoc to the whole arcade where he lives."
Godzilla vs. Kong,2021,"Action,Sci-Fi,Thriller",6.3,113,$100.92M,"$470,067,014",59,"206,514",The epic next chapter in the cinematic Monsterverse pits two of the greatest icons in motion picture history against each other--the fearsome Godzilla and the mighty Kong--with humanity caught in the balance.
The Hangover,2009,Comedy,7.7,100,$277.32M,"$469,328,079",73,"781,265","Three buddies wake up from a bachelor party in Las Vegas, with no memory of the previous night and the bachelor missing. They make their way around the city in order to find their friend before his wedding."
The Lego Movie,2014,"Animation,Action,Adventure",7.7,100,$257.76M,"$468,266,122",83,"354,346","An ordinary LEGO construction worker, thought to be the prophesied as ""special"", is recruited to join a quest to stop an evil tyrant from gluing the LEGO universe into eternal stasis."
Bumblebee,2018,"Action,Adventure,Sci-Fi",6.7,114,$127.20M,"$467,989,645",66,"164,926","On the run in the year 1987, Bumblebee finds refuge in a junkyard in a small California beach town. On the cusp of turning 18 and trying to find her place in the world, Charlie Watson discovers Bumblebee, battle-scarred and broken."
Star Trek Into Darkness,2013,"Action,Adventure,Sci-Fi",7.7,132,$228.78M,"$467,365,246",72,"483,380","After the crew of the Enterprise find an unstoppable force of terror from within their own organization, Captain Kirk leads a manhunt to a war-zone world to capture a one-man weapon of mass destruction."
The Matrix,1999,"Action,Sci-Fi",8.7,136,$171.48M,"$467,222,728",73,"1,895,339","When a beautiful stranger leads computer hacker Neo to a forbidding underworld, he discovers the shocking truth--the life he knows is the elaborate deception of an evil cyber-intelligence."
Gladiator,2000,"Action,Adventure,Drama",8.5,155,$187.71M,"$465,380,802",67,"1,485,912",A former Roman General sets out to exact vengeance against the corrupt emperor who murdered his family and sent him into slavery.
Pretty Woman,1990,"Comedy,Romance",7.1,119,$178.41M,"$463,406,268",51,"324,063","A man in a legal but hurtful business needs an escort for some social events, and hires a beautiful prostitute he meets... only to fall in love."
Cars,2006,"Animation,Adventure,Comedy",7.2,117,$244.08M,"$461,991,867",73,"419,343","On the way to the biggest race of his life, a hotshot rookie race car gets stranded in a rundown town, and learns that winning isn't everything in life."
Ba bai,2020,"Action,Drama,History",6.7,149,$0.37M,"$461,421,559",64,"5,832","From the acclaimed filmmaker behind Mr. Six comes a riveting war epic. In 1937, eight hundred Chinese soldiers fight under siege from a warehouse in the middle of the Shanghai battlefield, completely surrounded by the Japanese army."
X-Men: The Last Stand,2006,"Action,Adventure,Sci-Fi",6.6,104,$234.36M,"$460,435,291",58,"516,297","The human government develops a cure for mutations, and Jean Gray becomes a darker uncontrollable persona called the Phoenix who allies with Magneto, causing escalation into an all-out battle for the X-Men."
National Treasure: Book of Secrets,2007,"Action,Adventure,Mystery",6.5,124,$219.96M,"$459,242,249",48,"237,913",Benjamin Gates must follow a clue left in John Wilkes Booth's diary to prove his ancestor's innocence in the assassination of Abraham Lincoln.
Lucy,2014,"Action,Sci-Fi,Thriller",6.4,89,$126.66M,"$458,863,600",61,"494,639","A woman, accidentally caught in a dark deal, turns the tables on her captors and transforms into a merciless warrior evolved beyond human logic."
Mission: Impossible,1996,"Action,Adventure,Thriller",7.1,110,$180.98M,"$457,696,391",59,"425,965","An American agent, under false suspicion of disloyalty, must discover and expose the real spy without the help of his organization."
300,2006,"Action,Drama",7.6,117,$210.61M,"$456,082,343",52,"816,922",King Leonidas of Sparta and a force of 300 men fight the Persians at Thermopylae in 480 B.C.
The Last Samurai,2003,"Action,Drama",7.8,154,$111.11M,"$454,627,263",55,"440,027",An American military advisor embraces the Samurai culture he was hired to destroy after he is captured in battle.
Kimetsu no Yaiba: Mugen Ressha-Hen,2020,"Animation,Action,Adventure",8.2,117,$47.70M,"$453,210,959",72,"56,907","After his family was brutally murdered and his sister turned into a demon, Tanjiro Kamado's journey as a demon slayer began. Tanjiro and his comrades embark on a new mission aboard the Mugen Train, on track to despair."
Wo bu shi yao shen,2018,"Comedy,Drama",7.8,117,$0.01M,"$451,183,391",63,"6,479",A story on how a small drug store owner became the exclusive selling agent of a cheap Indian generic drug against Chronic Granulocytic Leukemia in China.
Ocean's Eleven,2001,"Crime,Thriller",7.7,116,$183.42M,"$450,717,150",74,"571,258",Danny Ocean and his ten accomplices plan to rob three Las Vegas casinos simultaneously.
Wo he wo de zu guo,2019,"Drama,History",6.3,154,$2.36M,"$450,064,993",******,"1,892","An anthology film consist of 7 short stories directed by several different directors, which are based on 7 moments since the founding of People's Republic of China."
Thor,2011,"Action,Adventure,Fantasy",7.0,115,$181.03M,"$449,326,618",57,"844,378","The powerful but arrogant god Thor is cast out of Asgard to live amongst humans in Midgard (Earth), where he soon becomes one of their finest defenders."
Pearl Harbor,2001,"Action,Drama,History",6.2,183,$198.54M,"$449,220,945",44,"332,611",A tale of war and romance mixed in with history. The story follows two lifelong friends and a beautiful nurse who are caught up in the horror of an infamous Sunday morning in 1941.
La La Land,2016,"Comedy,Drama,Music",8.0,128,$151.10M,"$448,906,865",94,"581,482","While navigating their careers in Los Angeles, a pianist and an actress fall in love while attempting to reconcile their aspirations for the future."
Tarzan,1999,"Animation,Adventure,Comedy",7.3,88,$171.09M,"$448,191,819",79,"226,365",A man raised by gorillas must decide where he really belongs when he discovers he is a human.
Men in Black II,2002,"Action,Adventure,Comedy",6.1,88,$190.42M,"$445,135,288",49,"374,914",Agent Jay is sent to find Agent Kay and restore his memory after the re-appearance of a case from Kay's past.
The Bourne Ultimatum,2007,"Action,Mystery,Thriller",8.0,115,$227.47M,"$444,100,035",85,"633,900",Jason Bourne dodges a ruthless C.I.A. official and his Agents from a new assassination program while searching for the origins of his life as a trained killer.
The Mummy Returns,2001,"Action,Adventure,Fantasy",6.4,130,$202.02M,"$443,280,904",48,"325,179","The mummified body of Imhotep is shipped to a museum in London, where he once again wakes and begins his campaign of rage and terror."
Alvin and the Chipmunks: The Squeakquel,2009,"Animation,Adventure,Comedy",4.5,88,$219.61M,"$443,140,005",41,"49,552","The world-famous singing preteen chipmunk trio return to contend with the pressures of school, celebrity, and a rival female music group known as The Chipettes."
Les Misérables,2012,"Drama,Musical,Romance",7.5,158,$148.81M,"$442,299,309",63,"329,707","In 19th-century France, Jean Valjean, who for decades has been hunted by the ruthless policeman Javert after breaking parole, agrees to care for a factory worker's daughter. The decision changes their lives forever."
The Exorcist,1973,Horror,8.1,122,$232.91M,"$441,306,145",81,"403,949","When a teenage girl is possessed by a mysterious entity, her mother seeks the help of two priests to save her daughter."
Mrs. Doubtfire,1993,"Comedy,Drama",7.1,125,$219.20M,"$441,286,195",53,"268,073","After a bitter divorce, an actor disguises himself as a female housekeeper to spend time with his children held in custody by his former wife."
Terminator Genisys,2015,"Action,Adventure,Sci-Fi",6.3,126,$89.76M,"$440,603,537",38,"278,084","When John Connor, leader of the human resistance, sends Sgt. Kyle Reese back to 1984 to protect Sarah Connor and safeguard the future, an unexpected turn of events creates a fractured timeline."
Warcraft,2016,"Action,Adventure,Fantasy",6.7,123,$47.37M,"$439,048,914",32,"263,969","As an Orc horde invades the planet Azeroth using a magic portal, a few human heroes and dissenting Orcs must attempt to stop the true evil behind this war."
A Star Is Born,2018,"Drama,Music,Romance",7.6,136,$215.29M,"$436,233,122",88,"381,604",A musician helps a young singer find fame as age and alcoholism send his own career into a downward spiral.
The Greatest Showman,2017,"Biography,Drama,Musical",7.5,105,$174.34M,"$435,732,529",48,"280,057",Celebrates the birth of show business and tells of a visionary who rose from nothing to create a spectacle that became a worldwide sensation.
Terminator 3: Rise of the Machines,2003,"Action,Sci-Fi",6.3,109,$150.37M,"$433,371,112",66,"399,649",A machine from a post-apocalyptic future travels back in time to protect a man and a woman from an advanced robotic assassin to ensure they both survive a nuclear attack.
Pokémon: Detective Pikachu,2019,"Action,Adventure,Comedy",6.5,104,$144.11M,"$433,230,304",53,"162,859","In a world where people collect Pokémon to do battle, a boy comes across an intelligent talking Pikachu who seeks to be a detective."
Shang-Chi and the Legend of the Ten Rings,2021,"Action,Adventure,Fantasy",7.4,132,$224.54M,"$432,243,292",71,"374,342","Shang-Chi, the master of weaponry-based Kung Fu, is forced to confront his past after being drawn into the Ten Rings organization."
Die Another Day,2002,"Action,Adventure,Thriller",6.1,133,$160.94M,"$431,971,116",56,"219,747","James Bond is sent to investigate the connection between a North Korean terrorist and a diamond mogul, who is funding the development of an international space weapon."
The Secret Life of Pets 2,2019,"Animation,Adventure,Comedy",6.4,86,$158.87M,"$430,051,293",55,"62,383","Continuing the story of Max and his pet friends, following their secret lives after their owners leave them for work or school each day."
Cast Away,2000,"Adventure,Drama,Romance",7.8,143,$233.63M,"$429,632,142",73,"588,627",A FedEx executive undergoes a physical and emotional transformation after crash landing on a deserted island.
