Movie Title,Year of Realease,Genre,Movie Rating,Duration,Gross,Worldwide LT Gross,Metascore,Votes,Logline
Fast & Furious,2009,"Action,Crime,Thriller",6.5,107,$155.06M,"$360,366,870",46,"287,198","Brian O'Conner, back working for the FBI in Los Angeles, teams up with Dominic Toretto to bring down a heroin importer by infiltrating his operation."
Noah,2014,"Action,Adventure,Drama",5.8,138,$101.20M,"$359,200,044",68,"255,465",Noah is chosen by God to undertake a momentous mission before an apocalyptic flood cleanses the world.
The Karate Kid,2010,"Action,Drama,Family",6.2,140,$176.59M,"$359,126,022",61,"183,996","Work causes a single mother to move to China with her young son; in his new home, the boy embraces kung fu, taught to him by a master."
Home Alone 2: Lost in New York,1992,"Adventure,Comedy,Crime",6.8,120,$173.59M,"$358,994,850",46,"352,040","One year after Kevin McCallister was left home alone and had to defeat a pair of bumbling burglars, he accidentally finds himself stranded in New York City - and the same criminals are not far behind."
Hotel Transylvania,2012,"Animation,Adventure,Comedy",7.0,91,$148.31M,"$358,375,603",47,"255,194","Dracula, who operates a high-end resort away from the human world, goes into overprotective mode when a boy discovers the resort and falls for the count's teenaged daughter."
Minority Report,2002,"Action,Crime,Mystery",7.7,145,$132.07M,"$358,372,926",80,"549,888","In a future where a special police unit is able to arrest murderers before they commit their crimes, an officer from that unit is himself accused of a future murder."
Kimi no na wa.,2016,"Animation,Drama,Fantasy",8.4,106,$5.02M,"$358,180,115",79,"264,127","Two strangers find themselves linked in a bizarre way. When a connection forms, will distance be the only thing to keep them apart?"
Top Gun,1986,"Action,Drama",6.9,110,$179.80M,"$357,288,178",50,"430,656","As students at the United States Navy's elite fighter weapons school compete to be best in the class, one daring young pilot learns a few things from a civilian instructor that are not taught in the classroom."
The Legend of Tarzan,2016,"Action,Adventure,Drama",6.2,110,$126.64M,"$356,700,357",44,"177,341","Tarzan, having acclimated to life in London, is called back to his former home in the jungle to investigate the activities at a mining encampment."
American Beauty,1999,Drama,8.4,122,$130.10M,"$356,296,601",84,"1,148,186",A sexually frustrated suburban father has a mid-life crisis after becoming infatuated with his daughter's best friend.
Sen to Chihiro no kamikakushi,2001,"Animation,Adventure,Family",8.6,125,$10.06M,"$355,725,195",96,"753,968","During her family's move to the suburbs, a sullen 10-year-old girl wanders into a world ruled by gods, witches, and spirits, and where humans are changed into beasts."
Apollo 13,1995,"Adventure,Drama,History",7.7,140,$173.84M,"$355,237,933",77,"294,911",NASA must devise a strategy to return Apollo 13 to Earth safely after the spacecraft undergoes massive internal damage putting the lives of the three astronauts on board in jeopardy.
Rain Man,1988,Drama,8.0,133,$178.80M,"$354,825,435",65,"512,762","After a selfish L.A. yuppie learns his estranged father left a fortune to an autistic-savant brother in Ohio that he didn't know existed, he absconds with his brother and sets out across the country, hoping to gain a larger inheritance."
The Great Gatsby,2013,"Drama,Romance",7.2,143,$144.84M,"$353,659,851",55,"541,556","A writer and wall street trader, Nick, finds himself drawn to the past and lifestyle of his millionaire neighbor, Jay Gatsby."
Dumbo,2019,"Adventure,Family,Fantasy",6.3,112,$114.77M,"$353,284,621",51,"76,096","A young elephant, whose oversized ears enable him to fly, helps save a struggling circus, but when the circus plans a new venture, Dumbo and his friends discover dark secrets beneath its shiny veneer."
"I, Robot",2004,"Action,Mystery,Sci-Fi",7.1,115,$144.80M,"$353,133,898",59,"538,880","In 2035, a technophobic cop investigates a crime that may have been perpetrated by a robot, which leads to a larger threat to humanity."
Basic Instinct,1992,"Drama,Mystery,Thriller",7.0,127,$117.73M,"$352,927,224",41,"200,383",A violent police detective investigates a brutal murder that might involve a manipulative and seductive novelist.
Murder on the Orient Express,2017,"Crime,Drama,Mystery",6.5,114,$102.83M,"$352,794,081",52,"256,936","When a murder occurs on the train on which he's travelling, celebrated detective Hercule Poirot is recruited to solve the case."
X: First Class,2011,"Action,Adventure,Sci-Fi",7.7,131,$146.41M,"$352,616,690",65,"690,853","In the 1960s, superpowered humans Charles Xavier and Erik Lensherr work together to find others like them, but Erik's vengeful pursuit of an ambitious mutant who ruined his life causes a schism to divide them."
Angry Birds,2016,"Animation,Action,Adventure",6.3,97,$107.51M,"$352,333,929",43,"93,189","When an island populated by happy, flightless birds is visited by mysterious green piggies, it's up to three unlikely outcasts - Red, Chuck and Bomb - to figure out what the pigs are up to."
GoldenEye,1995,"Action,Adventure,Thriller",7.2,130,$106.60M,"$352,194,034",65,"257,479","Years after a friend and fellow 00 agent is killed on a joint mission, a Russian crime syndicate steals a secret space-based weapons program known as ""GoldenEye"" and James Bond has to stop them from using it."
Catch Me If You Can,2002,"Biography,Crime,Drama",8.1,141,$164.62M,"$352,114,312",75,"969,691","Barely 21 yet, Frank is a skilled forger who has passed as a doctor, lawyer and pilot. FBI agent Carl becomes obsessed with tracking down the con man, who only revels in the pursuit."
Now You See Me,2013,"Crime,Mystery,Thriller",7.2,115,$117.72M,"$351,723,989",50,"656,647","An F.B.I. Agent and an Interpol Detective track a team of illusionists who pull off bank heists during their performances, and reward their audiences with the money."
Hannibal,2001,"Crime,Drama,Thriller",6.8,131,$165.09M,"$351,692,268",57,"275,159","Living in exile, Dr. Hannibal Lecter tries to reconnect with now disgraced F.B.I. Agent Clarice Starling, and finds himself a target for revenge from a powerful victim."
The Mask,1994,"Action,Comedy,Crime",6.9,101,$119.94M,"$351,583,407",56,"384,946",Bank clerk Stanley Ipkiss is transformed into a manic superhero when he wears a mysterious mask.
Peter Rabbit,2018,"Adventure,Comedy,Crime",6.6,95,$115.25M,"$351,496,066",51,"43,258",A rebellious rabbit tries to sneak into a farmer's vegetable garden.
Speed,1994,"Action,Adventure,Thriller",7.3,116,$121.25M,"$350,448,145",78,"363,407",A young police officer must prevent a bomb exploding aboard a city bus by keeping its speed above 50 mph.
Dinosaur,2000,"Animation,Adventure,Drama",6.4,82,$137.75M,"$349,822,765",56,"61,274",An orphaned dinosaur raised by lemurs joins an arduous trek to a sanctuary after a meteorite shower destroys his family home.
Mary Poppins Returns,2018,"Animation,Adventure,Comedy",6.7,130,$171.96M,"$349,546,142",66,"88,275","A few decades after her original visit, Mary Poppins, the magical nanny, returns to help the Banks siblings and Michael's children through a difficult time in their lives."
Deep Impact,1998,"Action,Drama,Sci-Fi",6.2,120,$140.46M,"$349,464,664",40,"179,125","A comet is discovered to be on a collision course with Earth. As doomsday nears, the human race prepares for the worst."
The Lorax,2012,"Animation,Adventure,Comedy",6.4,86,$214.03M,"$349,183,316",46,"113,547","A 12-year-old boy searches for the one thing that will enable him to win the affection of the girl of his dreams. To find it he must discover the story of the Lorax, the grumpy yet charming creature who fights to protect his world."
The Maze Runner,2014,"Action,Mystery,Sci-Fi",6.8,113,$102.43M,"$348,319,861",57,"465,068","Thomas is deposited in a community of boys after his memory is erased, soon learning they're all trapped in a maze that will require him to join forces with fellow ""runners"" for a shot at escape."
The Smurfs 2,2013,"Animation,Adventure,Comedy",5.3,105,$71.02M,"$347,545,360",34,"42,457","The Smurfs team up with their human friends to rescue Smurfette, who has been abducted by Gargamel, since she knows a secret spell that can turn the evil sorcerer's newest creation, creatures called ""The Naughties"", into real Smurfs."
National Treasure,2004,"Action,Adventure,Mystery",6.9,131,$173.01M,"$347,512,318",39,"332,482",A historian races to find the legendary Templar Treasure before a team of mercenaries.
Rush Hour 2,2001,"Action,Comedy,Crime",6.6,90,$226.16M,"$347,325,802",48,"220,002","Carter and Lee head to Hong Kong for a vacation, but become embroiled in a counterfeit money scam."
Trolls,2016,"Animation,Adventure,Comedy",6.4,92,$153.71M,"$347,182,886",55,"82,121","After the Bergens invade Troll Village, Poppy, the happiest Troll ever born, and the curmudgeonly Branch set off on a journey to rescue her friends."
xXx: Return of Xander Cage,2017,"Action,Adventure,Thriller",5.2,107,$44.90M,"$346,118,277",42,"92,468","Xander Cage is left for dead after an incident, though he secretly returns to action for a new, tough assignment with his handler Augustus Gibbons."
Pocahontas,1995,"Animation,Adventure,Drama",6.7,81,$141.60M,"$346,079,773",58,"187,513",An English soldier and the daughter of an Algonquin chief share a romance when English colonists invade seventeenth century Virginia.
How the Grinch Stole Christmas,2000,"Comedy,Family,Fantasy",6.2,104,$260.04M,"$345,823,032",46,"245,026","On the outskirts of Whoville lives a green, revenge-seeking Grinch who plans to ruin Christmas for all of the citizens of the town."
Star Trek Beyond,2016,"Action,Adventure,Sci-Fi",7.0,122,$158.85M,"$343,471,816",68,"246,473","The crew of the USS Enterprise explores the furthest reaches of uncharted space, where they encounter a new ruthless enemy, who puts them, and everything the Federation stands for, to the test."
Alvin and the Chipmunks: Chipwrecked,2011,"Animation,Adventure,Comedy",4.3,87,$133.11M,"$342,695,435",24,"35,773","Playing around while aboard a cruise ship, the Chipmunks and Chipettes accidentally go overboard and end up marooned in a tropical paradise. They discover their new turf is not as deserted as it seems."
Wanted,2008,"Action,Crime,Thriller",6.7,110,$134.51M,"$342,463,063",64,"389,301","A frustrated office worker discovers that he is the son of a professional assassin, and that he shares his father's superhuman killing abilities."
The Flintstones,1994,"Comedy,Family,Fantasy",4.9,91,$130.51M,"$341,631,208",38,"81,670","In a parallel modern-day Stone Age world, a working-class family, the Flintstones, are set up for an executive job. But they learn that money can't buy happiness."
A Quiet Place,2018,"Drama,Horror,Sci-Fi",7.5,90,$188.02M,"$340,952,971",82,"522,995","In a post-apocalyptic world, a family is forced to live in silence while hiding from monsters with ultra-sensitive hearing."
Enchanted,2007,"Animation,Adventure,Comedy",7.1,107,$127.81M,"$340,487,836",75,"199,265","A young maiden in a land called Andalasia, who is prepared to be wed, is sent away to New York City by an evil Queen, where she falls in love with a lawyer."
Over the Hedge,2006,"Animation,Adventure,Comedy",6.7,83,$155.02M,"$339,795,890",67,"175,604","A scheming raccoon fools a mismatched family of forest creatures into helping him repay a debt of food, by invading the new suburban sprawl that popped up while they were hibernating...and learns a lesson about family himself."
300: Rise of an Empire,2014,"Action,Drama",6.2,102,$106.58M,"$337,580,051",48,"301,454","Greek general Themistocles of Athens leads the naval charge against invading Persian forces led by mortal-turned-god Xerxes and Artemisia, vengeful commander of the Persian navy."
Batman Forever,1995,"Action,Adventure",5.4,121,$184.03M,"$336,567,158",51,"253,427","Batman must battle former district attorney Harvey Dent, who is now Two-Face and Edward Nygma, The Riddler with help from an amorous psychologist and a young circus acrobat who becomes his sidekick, Robin."
Prince of Persia: The Sands of Time,2010,"Action,Adventure,Fantasy",6.6,116,$90.76M,"$336,365,676",50,"290,140",A young fugitive prince and princess must stop a villain who unknowingly threatens to destroy the world with a special dagger that enables the magic sand inside to reverse time.
The Curious Case of Benjamin Button,2008,"Drama,Fantasy,Romance",7.8,166,$127.51M,"$335,802,786",70,"647,546","Tells the story of Benjamin Button, a man who starts aging backwards with consequences."
Journey 2: The Mysterious Island,2012,"Action,Adventure,Comedy",5.7,94,$103.86M,"$335,287,748",41,"104,779","Sean Anderson partners with his mom's husband on a mission to find his grandfather, who is thought to be missing on a mythical island."
The Rock,1996,"Action,Adventure,Thriller",7.4,136,$134.07M,"$335,062,621",58,"338,124","A mild-mannered chemist and an ex-con must lead the counterstrike when a rogue group of military men, led by a renegade general, threaten a nerve gas attack from Alcatraz against San Francisco."
The Great Wall,2016,"Action,Adventure,Fantasy",5.9,103,$45.54M,"$334,933,831",42,"136,347","In ancient China, a group of European mercenaries encounters a secret army that maintains and defends the Great Wall of China against a horde of monstrous creatures."
Now You See Me 2,2016,"Action,Adventure,Comedy",6.4,129,$65.08M,"$334,897,606",46,"288,770","The Four Horsemen resurface, and are forcibly recruited by a tech genius to pull off their most impossible heist yet."
Xiu xiu de tie quan,2017,"Comedy,Fantasy,Sport",6.1,100,******,"$334,530,869",******,"1,591",A male UFC boxer switches bodies with the female reporter who exposed his bribes. Now they must help each other win the championship.
Fantastic Four,2005,"Action,Adventure,Fantasy",5.7,106,$154.70M,"$333,535,934",40,"330,331","A group of astronauts gain superpowers after a cosmic radiation exposure and must use them to oppose the plans of their enemy, Doctor Victor Von Doom."
Indiana Jones and the Temple of Doom,1984,"Action,Adventure",7.5,118,$179.87M,"$333,107,271",57,"486,281","A skirmish in Shanghai puts archaeologist Indiana Jones, his partner Short Round and singer Willie Scott crossing paths with an Indian village desperate to reclaim a rock stolen by a secret cult beneath the catacombs of an ancient palace."
Tomorrow Never Dies,1997,"Action,Adventure,Thriller",6.5,119,$125.33M,"$333,011,068",52,"195,105",James Bond sets out to stop a media mogul's plan to induce war between China and the UK in order to obtain exclusive global media coverage.
Back to the Future Part II,1989,"Adventure,Comedy,Sci-Fi",7.8,108,$118.50M,"$332,500,002",57,"529,620","After visiting 2015, Marty McFly must repeat his visit to 1955 to prevent disastrous changes to 1985...without interfering with his first trip."
The Good Dinosaur,2015,"Animation,Adventure,Comedy",6.7,93,$123.09M,"$332,207,671",66,"116,115","In a world where dinosaurs and humans live side-by-side, an Apatosaurus named Arlo makes an unlikely human friend."
Free Guy,2021,"Action,Adventure,Comedy",7.1,115,$121.63M,"$331,526,598",62,"362,859","A bank teller discovers that he's actually an NPC inside a brutal, open world video game."
22 Jump Street,2014,"Action,Comedy,Crime",7.0,112,$191.72M,"$331,333,876",71,"376,664","After making their way through high school (twice), big changes are in store for officers Schmidt and Jenko when they go deep undercover at a local college."
Meet the Parents,2000,"Comedy,Romance",7.0,108,$166.24M,"$330,444,045",73,"335,066","Male nurse Greg Focker meets his girlfriend's parents before proposing, but her suspicious father is every date's worst nightmare."
Who Framed Roger Rabbit,1988,"Animation,Adventure,Comedy",7.7,104,$156.45M,"$329,803,958",83,"201,427",A toon-hating detective is a cartoon rabbit's only hope to prove his innocence when he is accused of murder.
Black Swan,2010,"Drama,Thriller",8.0,108,$106.95M,"$329,398,046",79,"761,933","A committed dancer struggles to maintain her sanity after winning the lead role in a production of Tchaikovsky's ""Swan Lake""."
The Perfect Storm,2000,"Action,Adventure,Drama",6.4,130,$182.62M,"$328,718,434",59,"168,607",An unusually intense storm pattern catches some commercial fishermen unaware and puts them in mortal danger.
Crocodile Dundee,1986,"Action,Adventure,Comedy",6.6,97,$174.64M,"$328,203,506",62,"105,852",An American reporter goes to the Australian outback to meet an eccentric crocodile poacher and invites him to New York City.
Feng kuang de wai xing ren,2019,"Comedy,Sci-Fi",5.8,116,******,"$327,598,891",******,"1,348","A monkey trainer whose act goes wrong after an alien crash lands on Earth and injures his monkey. Desperate to perform the act, he attempts to train the alien instead, but is punished after the alien regains his powers."
Se7en,1995,"Crime,Drama,Mystery",8.6,127,$100.13M,"$327,333,559",65,"1,632,302","Two detectives, a rookie and a veteran, hunt a serial killer who uses the seven deadly sins as his motives."
John Wick: Chapter 3 - Parabellum,2019,"Action,Crime,Thriller",7.4,130,$171.02M,"$327,281,779",73,"339,342","John Wick is on the run after killing a member of the international assassins' guild, and with a $14 million price tag on his head, he is the target of hit men and women everywhere."
The Devil Wears Prada,2006,"Comedy,Drama",6.9,109,$124.74M,"$326,706,115",62,"418,066","A smart but sensible new graduate lands a job as an assistant to Miranda Priestly, the demanding editor-in-chief of a high fashion magazine."
Taken 3,2014,"Action,Crime,Thriller",6.0,108,$89.26M,"$326,479,141",26,"193,097","Accused of a ruthless murder he never committed or witnessed, Bryan Mills goes on the run and brings out his particular set of skills to find the true killer and clear his name."
The Hunchback of Notre Dame,1996,"Animation,Drama,Family",7.0,91,$100.14M,"$325,338,851",74,"157,987","A deformed bell-ringer must assert his independence from a vicious government minister in order to help his friend, a gypsy dancer."
A Christmas Carol,2009,"Animation,Adventure,Comedy",6.8,96,$137.86M,"$325,286,646",55,"115,451","An animated retelling of Charles Dickens' classic novel about a Victorian-era miser taken on a journey of self-redemption, courtesy of several mysterious Christmas apparitions."
The SpongeBob Movie: Sponge Out of Water,2015,"Animation,Adventure,Comedy",6.0,92,$162.99M,"$325,186,032",62,"55,845","When a diabolical pirate above the sea steals the secret Krabby Patty formula, SpongeBob and his nemesis Plankton must team up in order to get it back."
Schindler's List,1993,"Biography,Drama,History",9.0,195,$96.90M,"$322,161,245",94,"1,343,317","In German-occupied Poland during World War II, industrialist Oskar Schindler gradually becomes concerned for his Jewish workforce after witnessing their persecution by the Nazis."
Megamind,2010,"Animation,Action,Comedy",7.3,95,$148.42M,"$321,885,765",63,"260,991","Evil genius Megamind finally defeats his do-gooder nemesis, Metro Man, but is left without a purpose in a superhero-free world."
The Conjuring 2,2016,"Horror,Mystery,Thriller",7.3,134,$102.47M,"$321,834,351",65,"269,246",Ed and Lorraine Warren travel to North London to help a single mother raising four children alone in a house plagued by a supernatural spirit.
Green Book,2018,"Biography,Comedy,Drama",8.2,130,$85.08M,"$321,752,656",69,"483,838",A working-class Italian-American bouncer becomes the driver for an African-American classical pianist on a tour of venues through the 1960s American South.
Lethal Weapon 3,1992,"Action,Crime,Thriller",6.7,118,$144.73M,"$321,731,527",40,"168,977",Martin Riggs and Roger Murtaugh pursue a former LAPD officer who uses his knowledge of police procedure and policies to steal and sell confiscated guns and ammunition to local street gangs.
Robin Hood,2010,"Action,Adventure,Drama",6.6,140,$105.27M,"$321,669,741",53,"269,547","In twelfth-century England, Robin Longstride and his band of marauders confront corruption in a local village and lead an uprising against the crown that will forever alter the balance of world power."
Inglourious Basterds,2009,"Adventure,Drama,War",8.3,153,$120.54M,"$321,457,747",69,"1,431,553","In Nazi-occupied France during World War II, a plan to assassinate Nazi leaders by a group of Jewish U.S. soldiers coincides with a theatre owner's vengeful plans for the same."
101 Dalmatians,1996,"Adventure,Comedy,Crime",5.7,103,$136.19M,"$320,689,294",49,"111,625",An evil high-fashion designer plots to steal dalmatian puppies in order to make an extravagant fur coat but creates an extravagant mess instead.
The Conjuring,2013,"Horror,Mystery,Thriller",7.5,112,$137.40M,"$320,406,242",68,"504,495",Paranormal investigators Ed and Lorraine Warren work to help a family terrorized by a dark presence in their farmhouse.
Fatal Attraction,1987,"Drama,Thriller",6.9,119,$156.65M,"$320,145,693",67,"87,159",A married man's one-night stand comes back to haunt him when that lover begins to stalk him and his family.
Sonic the Hedgehog,2020,"Action,Adventure,Comedy",6.5,99,$148.97M,"$319,715,683",47,"138,657","After discovering a small, blue, fast hedgehog, a small-town police officer must help him defeat an evil genius who wants to do experiments on him."
The Last Airbender,2010,"Action,Adventure,Family",4.0,103,$131.56M,"$319,713,881",20,"164,006","Follows the adventures of Aang, a young successor to a long line of Avatars, who must master all four elements and stop the Fire Nation from enslaving the Water Tribes and the Earth Kingdom."
The Proposal,2009,"Comedy,Drama,Romance",6.7,108,$163.96M,"$317,375,031",48,"327,779",A pushy boss forces her young assistant to marry her in order to keep her visa status in the U.S. and avoid deportation to Canada.
A Beautiful Mind,2001,"Biography,Drama",8.2,135,$170.74M,"$316,791,257",72,"927,229","After John Nash, a brilliant but asocial mathematician, accepts secret work in cryptography, his life takes a turn for the nightmarish."
Beverly Hills Cop,1984,"Action,Comedy,Crime",7.3,105,$234.76M,"$316,360,478",66,"184,195",A freewheeling Detroit cop pursuing a murder investigation finds himself dealing with the very different culture of Beverly Hills.
The Polar Express,2004,"Animation,Adventure,Comedy",6.6,100,$183.37M,"$315,249,768",61,"206,563","On Christmas Eve, a young boy embarks on a magical adventure to the North Pole on the Polar Express, while learning about friendship, bravery, and the spirit of Christmas."
Air Force One,1997,"Action,Drama,Thriller",6.5,124,$172.96M,"$315,156,409",61,"196,674","Communist radicals hijack Air Force One with the U.S. President and his family on board. The Vice President negotiates from Washington D.C., while the President, a veteran, fights to rescue the hostages on board."
The Expendables 2,2012,"Action,Adventure,Thriller",6.6,103,$85.02M,"$314,975,955",51,"307,649","Mr. Church reunites the Expendables for what should be an easy paycheck, but when one of their men is murdered on the job, their quest for revenge puts them deep in enemy territory and up against an unexpected threat."
Chicken Little,2005,"Animation,Adventure,Comedy",5.7,81,$135.39M,"$314,432,837",48,"93,304","After ruining his reputation with the town, a courageous chicken must come to the rescue of his fellow citizens when aliens start an invasion."
As Good as It Gets,1997,"Comedy,Drama,Romance",7.7,139,$148.48M,"$314,178,011",67,"298,604","A single mother and waitress, a misanthropic author, and a gay artist form an unlikely friendship after the artist is assaulted in a robbery."
Maze Runner: The Scorch Trials,2015,"Action,Adventure,Sci-Fi",6.3,131,$81.70M,"$312,296,056",43,"250,276","After having escaped the Maze, the Gladers now face a new set of challenges on the open roads of a desolate landscape filled with unimaginable obstacles."
Resident Evil: The Final Chapter,2016,"Action,Horror,Sci-Fi",5.5,107,$26.83M,"$312,242,626",49,"94,579","Alice returns to where the nightmare began: The Hive in Raccoon City, where the Umbrella Corporation is gathering its forces for a final strike against the only remaining survivors of the apocalypse."
The Lego Batman Movie,2017,"Animation,Action,Adventure",7.3,104,$175.75M,"$312,136,671",75,"151,600","A cooler-than-ever Bruce Wayne must deal with the usual suspects as they plan to rule Gotham City, while discovering that he has accidentally adopted a teenage orphan who wishes to become his sidekick."
Austin Powers: The Spy Who Shagged Me,1999,"Action,Adventure,Comedy",6.6,95,$206.04M,"$312,016,928",59,"234,000","Dr. Evil is back and has invented a new time machine that allows him to go back to the 1960s and steal Austin Powers' mojo, inadvertently leaving him ""shagless""."
Knives Out,2019,"Comedy,Crime,Drama",7.9,130,$165.36M,"$311,605,581",82,"615,567","A detective investigates the death of the patriarch of an eccentric, combative family."
Ocean's Thirteen,2007,"Crime,Thriller",6.9,122,$117.15M,"$311,312,624",62,"346,822","Danny Ocean rounds up the boys for a third heist after casino owner Willy Bank double-crosses one of the original eleven, Reuben Tishkoff."
Little Fockers,2010,"Comedy,Romance",5.5,98,$148.38M,"$310,650,585",27,"113,255","Family-patriarch Jack Byrnes wants to appoint a successor. Does his son-in-law, the male nurse Greg Focker, have what it takes?"
Bolt,2008,"Animation,Adventure,Comedy",6.8,96,$114.05M,"$309,979,994",67,"211,167",The canine star of a fictional sci-fi/action show that believes his powers are real embarks on a cross country trek to save his co-star from a threat he believes is just as real.
Ransom,1996,"Action,Crime,Thriller",6.7,121,$136.49M,"$309,492,681",60,"128,875","Multi-millionaire Tom Mullen's son is kidnapped, but after initially agreeing to pay the ransom Mullen then decides to use the ransom money as a bounty."
