Movie Title,Year of Realease,Genre,Movie Rating,Duration,Gross,Worldwide LT Gross,Metascore,Votes,Logline
The Girl with the Dragon Tattoo,2011,"Crime,Drama,Mystery",7.8,158,$102.52M,"$232,617,430",71,"462,302",Journalist Mikael Blomkvist is aided in his search for a woman who has been missing for 40 years by young computer hacker Lisbeth Salander.
Juno,2007,"Comedy,Drama",7.5,96,$143.50M,"$232,372,681",81,"521,898","Faced with an unplanned pregnancy, an offbeat young woman makes an unusual decision regarding the unborn child."
Argo,2012,"Biography,Drama,Thriller",7.7,120,$136.03M,"$232,325,503",86,"613,402","Acting under the cover of a Hollywood producer scouting a location for a science fiction film, a CIA agent launches a dangerous operation to rescue six Americans in Tehran during the U.S. hostage crisis in Iran in 1979."
Mr. Bean's Holiday,2007,"Comedy,Family",6.4,90,$33.30M,"$232,225,908",56,"126,641","Mr. Bean wins a trip to Cannes where he unwittingly separates a young boy from his father and must help the two reunite. On the way he discovers France, bicycling, and true love."
The English Patient,1996,"Drama,Romance,War",7.4,162,$78.65M,"$231,976,425",87,"190,524","At the close of World War II, a young nurse tends to a badly-burned plane crash victim. His past is shown in flashbacks, revealing an involvement in a fateful love affair."
Sister Act,1992,"Comedy,Family,Music",6.5,100,$139.61M,"$231,605,150",51,"99,469","When a nightclub singer is forced to take refuge from the mob in a convent, she ends up turning the convent choir into a soulful chorus complete with a Motown repertoire, until the sudden celebrity of the choir jeopardizes her identity."
Annabelle Comes Home,2019,"Horror,Mystery,Thriller",5.9,106,$74.15M,"$231,252,591",53,"75,656","While babysitting the daughter of Ed and Lorraine Warren, a teenager and her friend unknowingly awaken an evil spirit trapped in a doll."
Constantine,2005,"Action,Fantasy,Horror",7.0,121,$75.98M,"$230,884,728",50,"345,895","Supernatural exorcist and demonologist John Constantine helps a policewoman prove her sister's death was not a suicide, but something more."
Get Smart,2008,"Action,Adventure,Comedy",6.5,110,$130.32M,"$230,685,453",54,"218,695","Maxwell Smart, a highly intellectual but bumbling spy working for the CONTROL agency, is tasked with preventing a terrorist attack from rival spy agency KAOS."
Space Jam,1996,"Animation,Adventure,Comedy",6.5,88,$90.46M,"$230,594,962",59,"197,989","In a desperate attempt to win a basketball match and earn their freedom, the Looney Tunes seek the aid of retired basketball champion, Michael Jordan."
La vita è bella,1997,"Comedy,Drama,Romance",8.6,116,$57.60M,"$230,098,753",59,"689,557","When an open-minded Jewish waiter and his son become victims of the Holocaust, he uses a perfect mixture of will, humor, and imagination to protect his son from the dangers around their camp."
The Heat,2013,"Action,Comedy,Crime",6.6,117,$159.58M,"$229,930,771",60,"172,940",An uptight FBI Special Agent is paired with a foul-mouthed Boston cop to take down a ruthless drug lord.
Ghostbusters,2016,"Action,Comedy,Fantasy",6.9,117,$128.34M,"$229,147,509",60,"231,550","Following a ghost invasion of Manhattan, paranormal enthusiasts Erin Gilbert and Abby Yates, nuclear engineer Jillian Holtzmann, and subway worker Patty Tolan band together to stop the otherworldly threat."
Ghost Rider,2007,"Action,Fantasy,Thriller",5.2,110,$115.80M,"$228,738,393",35,"239,770","When motorcycle rider Johnny Blaze sells his soul to the Devil to save his father's life, he is transformed into the Ghost Rider, the Devil's own bounty hunter, and is sent to hunt down sinners."
Xia Luo te fan nao,2015,Comedy,6.7,104,$1.29M,"$228,122,928",******,"2,976","After attending a wedding of his high school crush Qiuya, Xia Luo (Shen Teng) gets drunk embarrassing himself and angers his wife Ma Dongmei (Ma Li)."
Paddington 2,2017,"Adventure,Comedy,Family",7.8,103,$40.44M,"$227,994,792",88,"78,529","Paddington, now happily settled with the Brown family and a popular member of the local community, picks up a series of odd jobs to buy the perfect present for his Aunt Lucy's 100th birthday, only for the gift to be stolen."
Sleepless in Seattle,1993,"Comedy,Drama,Romance",6.8,105,$126.53M,"$227,927,165",72,"176,528",A recently widowed man's son calls a radio talk-show in an attempt to find his father a partner.
Lethal Weapon 2,1989,"Action,Crime,Thriller",7.2,114,$147.25M,"$227,853,986",70,"176,663",Riggs and Murtaugh are on the trail of South African diplomats who are using their immunity to engage in criminal activities.
The Green Hornet,2011,"Action,Comedy,Crime",5.8,119,$98.78M,"$227,817,248",39,"160,903","Following the death of his father, Britt Reid, heir to his father's large company, teams up with his late dad's assistant Kato to become a masked crime fighting team."
Out of Africa,1985,"Biography,Drama,Romance",7.1,161,$87.10M,"$227,514,205",69,"80,266","In 20th-century colonial Kenya, a Danish baroness/plantation owner has a passionate love affair with a free-spirited big-game hunter."
Fang hua,2017,"Drama,Romance,War",7.0,135,$1.89M,"$227,091,290",69,"3,159",A look at the lives of members of a Military Cultural Troupe in the 1970s.
Baby Driver,2017,"Action,Crime,Drama",7.6,113,$107.83M,"$226,945,087",86,"531,492","After being coerced into working for a crime boss, a young getaway driver finds himself taking part in a heist doomed to fail."
Immortals,2011,"Action,Drama,Fantasy",6.0,110,$83.50M,"$226,904,017",46,"169,079","Theseus is a mortal man chosen by Zeus to lead the fight against the ruthless King Hyperion, who is on a rampage across Greece to obtain a weapon that can destroy humanity."
Taken,2008,"Action,Crime,Thriller",7.8,90,$145.00M,"$226,837,760",51,"601,606","A retired CIA agent travels across Europe and relies on his old skills to save his estranged daughter, who has been kidnapped while on a trip to Paris."
Percy Jackson & the Olympians: The Lightning Thief,2010,"Adventure,Family,Fantasy",5.8,118,$88.76M,"$226,497,209",47,"189,434",A teenager discovers he's the descendant of a Greek god and sets out on an adventure to settle an on-going battle between the gods.
Hansel & Gretel: Witch Hunters,2013,"Action,Fantasy,Horror",6.1,88,$55.70M,"$226,349,749",23,"207,038",Brother/sister duo Hansel and Gretel are professional witch-hunters who help innocent villagers. One day they stumble upon a case that could hold the key to their past.
Lightyear,2022,"Animation,Action,Adventure",6.0,100,******,"$226,120,658",60,"97,542","While spending years attempting to return home, marooned Space Ranger Buzz Lightyear encounters an army of ruthless robots commanded by Zurg who are attempting to steal his fuel source."
Valerian and the City of a Thousand Planets,2017,"Action,Adventure,Fantasy",6.4,136,$41.19M,"$225,973,340",51,"181,635","A dark force threatens Alpha, a vast metropolis and home to species from a thousand planets. Special operatives Valerian and Laureline must race to identify the marauding menace and safeguard not just Alpha, but the future of the universe."
Good Will Hunting,1997,"Drama,Romance",8.3,126,$138.43M,"$225,933,435",70,"958,499","Will Hunting, a janitor at M.I.T., has a gift for mathematics, but needs help from a psychologist to find direction in his life."
Shaonian de ni,2019,"Crime,Drama,Romance",7.5,135,******,"$225,918,798",83,"9,790","A bullied teenage girl forms an unlikely friendship with a mysterious young man who protects her from her assailants, all while she copes with the pressures of her final examinations."
Ford v Ferrari,2019,"Action,Biography,Drama",8.1,152,$117.62M,"$225,508,210",81,"386,696",American car designer Carroll Shelby and driver Ken Miles battle corporate interference and the laws of physics to build a revolutionary race car for Ford in order to defeat Ferrari at the 24 Hours of Le Mans in 1966.
Jumper,2008,"Action,Adventure,Sci-Fi",6.1,88,$80.17M,"$225,132,113",35,"307,280",A teenager with teleportation abilities suddenly finds himself in the middle of an ancient war between those like him and their sworn annihilators.
Elf,2003,"Adventure,Comedy,Family",7.0,97,$173.40M,"$225,097,437",64,"265,528","Raised as an oversized elf, Buddy travels from the North Pole to New York City to meet his biological father, Walter Hobbs, who doesn't know he exists and is in desperate need of some Christmas spirit."
The Social Network,2010,"Biography,Drama",7.8,120,$96.96M,"$224,920,375",95,"698,176","As Harvard student Mark Zuckerberg creates the social networking site that would become known as Facebook, he is sued by the twins who claimed he stole their idea, and by the co-founder who was later squeezed out of the business."
Chicken Run,2000,"Animation,Adventure,Comedy",7.1,84,$106.83M,"$224,874,811",88,"192,451","When a cockerel apparently flies into a chicken farm, the chickens see him as an opportunity to escape their evil owners."
Con Air,1997,"Action,Crime,Thriller",6.9,115,$101.12M,"$224,012,234",52,"299,733",Newly-paroled ex-con and former U.S. Ranger Cameron Poe finds himself trapped in a prisoner-transport plane when the passengers seize control.
Interview with the Vampire: The Vampire Chronicles,1994,"Drama,Fantasy,Horror",7.5,123,$105.26M,"$223,664,608",59,"322,719","A vampire tells his epic life story: love, betrayal, loneliness, and hunger."
Flightplan,2005,"Drama,Mystery,Thriller",6.3,98,$89.71M,"$223,387,299",53,"163,219","A bereaved woman and her daughter are flying home from Berlin to America. At 30,000 feet, the child vanishes, and nobody will admit she was ever on the plane."
Yes Man,2008,"Comedy,Romance",6.8,104,$97.69M,"$223,241,637",46,"362,007","A man challenges himself to say ""yes"" to everything."
Non-Stop,2014,"Action,Mystery,Thriller",6.9,106,$92.17M,"$222,809,600",56,"264,924","An air marshal springs into action during a transatlantic flight after receiving a series of text messages demanding $150 million into an off-shore account, or someone will die every 20 minutes."
"Honey, I Shrunk the Kids",1989,"Adventure,Comedy,Family",6.4,93,$130.72M,"$222,724,172",63,"155,254",The scientist father of a teenage girl and boy accidentally shrinks his and two other neighborhood teens to the size of insects. Now the teens must fight diminutive dangers as the father searches for them.
Fahrenheit 9/11,2004,"Documentary,Drama,War",7.5,122,$119.19M,"$222,446,882",67,"129,811",Michael Moore's view on what happened to the United States after September 11 and how the Bush Administration allegedly used the tragic event to push forward its agenda for unjust wars in Afghanistan and Iraq.
Wild Wild West,1999,"Action,Comedy,Sci-Fi",4.9,106,$113.81M,"$222,104,681",38,"161,503","The two best special agents in the Wild West must save President Grant from the clutches of a diabolical, wheelchair-bound, steampunk-savvy, Confederate scientist bent on revenge for losing the Civil War."
Wo he wo de fu bei,2021,Drama,6.1,157,$0.18M,"$221,831,086",******,396,"Included as the third installment of ""National Day Celebration"" trilogy with My People, My Country (2019) and My People, My Homeland (2020), My Country, My Parents focuses on four Chinese ...                See full summary »"
Geostorm,2017,"Action,Sci-Fi,Thriller",5.3,109,$33.70M,"$221,600,160",21,"108,381","When the network of satellites designed to control the global climate starts to attack Earth, it's a race against the clock for its creator to uncover the real threat before a worldwide Geostorm wipes out everything and everyone."
Presumed Innocent,1990,"Mystery,Thriller",6.9,127,$86.30M,"$221,303,188",72,"42,551","As a lawyer investigates the murder of a colleague, he finds himself more connected to the crime than anyone else."
Jungle Cruise,2021,"Action,Adventure,Comedy",6.6,127,$116.99M,"$220,889,446",50,"186,684",Based on Disneyland's theme park ride where a small riverboat takes a group of travelers through a jungle filled with dangerous animals and reptiles but with a supernatural element.
Scary Movie 3,2003,Comedy,5.5,84,$110.00M,"$220,673,217",49,"148,137","Cindy must investigate mysterious crop circles and video tapes, and help the President in preventing an alien invasion."
Collateral,2004,"Action,Crime,Drama",7.5,120,$101.01M,"$220,239,925",71,"403,122",A cab driver finds himself the hostage of an engaging contract killer as he makes his rounds from hit to hit during one night in Los Angeles.
Inferno,2016,"Action,Adventure,Crime",6.2,121,$34.34M,"$220,021,259",42,"176,211","When Robert Langdon wakes up in an Italian hospital with amnesia, he teams up with Dr. Sienna Brooks and they race across Europe together against the clock to foil a deadly global plot."
Knocked Up,2007,"Comedy,Romance",6.9,129,$148.73M,"$219,922,417",85,"370,021","For fun-loving party animal Ben Stone, the last thing he ever expected was for his one-night stand to show up on his doorstep eight weeks later to tell him she's pregnant with his child."
Green Lantern,2011,"Action,Adventure,Sci-Fi",5.5,114,$116.60M,"$219,851,172",39,"285,243","Reckless test pilot Hal Jordan is granted an alien ring that bestows him with otherworldly powers that inducts him into an intergalactic police force, the Green Lantern Corps."
What Happens in Vegas,2008,"Comedy,Romance",6.1,99,$80.28M,"$219,375,562",36,"177,583","A man and a woman are compelled, for legal reasons, to live life as a couple for a limited period of time. At stake is a large amount of money."
It's Complicated,2009,"Comedy,Drama,Romance",6.5,121,$112.74M,"$219,103,655",57,"93,187","When attending their son's college graduation, a couple reignite the spark in their relationship. But the complicated fact is they're divorced and he's remarried."
The Terminal,2004,"Comedy,Drama,Romance",7.4,128,$77.87M,"$219,100,084",55,"457,518","An Eastern European tourist unexpectedly finds himself stranded in JFK airport, and must take up temporary residence there."
Captain Phillips,2013,"Action,Biography,Crime",7.8,134,$107.10M,"$218,791,811",82,"458,764","The true story of Captain Richard Phillips and the 2009 hijacking by Somali pirates of the U.S.-flagged MV Maersk Alabama, the first American cargo ship to be hijacked in two hundred years."
The Prince of Egypt,1998,"Animation,Adventure,Drama",7.1,99,$101.22M,"$218,613,188",64,"132,633",Egyptian Prince Moses learns of his identity as a Hebrew and his destiny to become the chosen deliverer of his people.
Jack Reacher,2012,"Action,Mystery,Thriller",7.0,130,$80.07M,"$218,340,595",50,"341,527",A homicide investigator digs deeper into a case involving a trained military sniper responsible for a mass shooting.
Kingdom of Heaven,2005,"Action,Adventure,Drama",7.2,144,$47.40M,"$218,122,627",63,"288,615","Balian of Ibelin travels to Jerusalem during the Crusades of the 12th century, and there he finds himself as the defender of the city and its people."
The Emoji Movie,2017,"Animation,Adventure,Comedy",3.3,86,$86.09M,"$217,776,646",12,"64,680","Gene, a multi-expressional emoji, sets out on a journey to become a normal emoji."
Zhe ge sha shou bu tai leng jing,2022,Comedy,6.1,109,******,"$217,254,604",******,513,"In order to fully realize his dream of being a comedian, Wei Chenggong (Wei Xiang) accidentally broke into a dangerous scam under the ""persuasion"" of actress Milan (Li Ma). But Wei ...                See full summary »"
Dracula Untold,2014,"Action,Drama,Fantasy",6.2,92,$56.28M,"$217,124,280",40,"195,378","As his kingdom is being threatened by the Turks, young prince Vlad Tepes must become a monster feared by his own people in order to obtain the power needed to protect his own family, and the families of his kingdom."
Central Intelligence,2016,"Action,Comedy,Crime",6.3,107,$127.44M,"$216,972,543",52,"190,383","After he reconnects with an awkward pal from high school through Facebook, a mild-mannered accountant is lured into the world of international espionage."
Million Dollar Baby,2004,"Drama,Sport",8.1,132,$100.49M,"$216,763,646",86,"684,956",A determined woman works with a hardened boxing trainer to become a professional.
The Help,2011,Drama,8.1,146,$169.71M,"$216,639,112",62,"457,691","An aspiring author during the civil rights movement of the 1960s decides to write a book detailing the African American maids' point of view on the white families for which they work, and the hardships they go through on a daily basis."
Twins,1988,"Comedy,Crime",6.1,107,$111.94M,"$216,614,388",53,"125,275","A physically perfect but innocent man goes in search of his long-lost twin brother, who is short, a womanizer, and small-time crook."
Little Women,2019,"Drama,Romance",7.8,135,$108.10M,"$216,601,214",91,"201,976","Jo March reflects back and forth on her life, telling the beloved story of the March sisters - four young women, each determined to live life on her own terms."
Valentine's Day,2010,"Comedy,Romance",5.7,125,$110.49M,"$216,528,528",34,"120,271",Intertwining couples and singles in Los Angeles break-up and make-up based on the pressures and expectations of Valentine's Day.
Bad Teacher,2011,"Comedy,Romance",5.6,92,$100.29M,"$216,197,492",47,"203,732","A lazy, incompetent middle school teacher who hates her job, her students, and her co-workers is forced to return to teaching to make enough money for breast implants after her wealthy fiancé dumps her."
Song ni yi duo xiao hong hua,2020,"Drama,Family",6.6,122,******,"$216,000,000",******,634,"The film tells a warm and realistic story, thinking and facing the ultimate problem that every ordinary person will face-imagining that death may come at any time, the only thing we have to do is love and cherish."
The Croods: A New Age,2020,"Animation,Adventure,Comedy",6.9,95,$58.57M,"$215,905,815",56,"43,280","The prehistoric family the Croods are challenged by a rival family the Bettermans, who claim to be better and more evolved."
Clear and Present Danger,1994,"Action,Crime,Drama",6.9,141,$122.19M,"$215,887,717",74,"100,222",CIA Analyst Jack Ryan is drawn into an illegal war fought by the US government against a Colombian drug cartel.
One Hundred and One Dalmatians,1961,"Animation,Adventure,Comedy",7.3,79,$144.88M,"$215,880,014",83,"168,257","When a litter of Dalmatian puppies are abducted by the minions of Cruella De Vil, the owners must find them before she uses them for a diabolical fashion statement."
Ted 2,2015,Comedy,6.3,115,$81.48M,"$215,863,606",48,"209,744","Newlywed couple Ted and Tami-Lynn want to have a baby, but in order to qualify to be a parent, Ted will have to prove he's a person in a court of law."
Dracula,1992,"Drama,Fantasy,Horror",7.4,128,$82.52M,"$215,862,692",57,"217,157",The centuries old vampire Count Dracula comes to England to seduce his barrister Jonathan Harker's fiancée Mina Murray and inflict havoc in the foreign land.
Vertical Limit,2000,"Action,Adventure,Drama",5.9,124,$69.24M,"$215,663,859",48,"62,163","A climber must rescue his sister on top of K2, one of the world's biggest mountains."
Ghostbusters II,1989,"Action,Comedy,Fantasy",6.6,108,$112.49M,"$215,394,738",56,"207,469",The discovery of a massive river of ectoplasm and a resurgence of spectral activity allows the staff of Ghostbusters to revive the business.
The Patriot,2000,"Action,Drama,History",7.2,165,$113.33M,"$215,294,342",63,"275,099",Peaceful farmer Benjamin Martin is driven to lead the Colonial Militia during the American Revolution when a sadistic British officer murders his son.
The Sorcerer's Apprentice,2010,"Action,Adventure,Family",6.1,109,$63.15M,"$215,283,742",46,"162,670","Balthazar Blake, an apprentice of the legendary magician Merlin, must train his old teacher's successor - an introverted but resourceful physics prodigy - in the art of sorcery to prevent the return of Morgana le Fay."
Just Go with It,2011,"Comedy,Romance",6.4,117,$103.03M,"$214,945,591",33,"244,880","On a weekend trip to Hawaii, a plastic surgeon convinces his loyal assistant to pose as his soon-to-be-divorced wife in order to cover up a careless lie he told to his much-younger girlfriend."
The Expendables 3,2014,"Action,Adventure,Thriller",6.1,126,$39.32M,"$214,657,577",35,"182,933","Barney augments his team with new blood for a personal battle: to take down Conrad Stonebanks, the Expendables co-founder and notorious arms trader who is hell bent on wiping out Barney and every single one of his associates."
Dirty Dancing,1987,"Drama,Music,Romance",7.0,100,$0.62M,"$214,577,242",65,"231,933","Spending the summer at a Catskills resort with her family, Frances ""Baby"" Houseman falls in love with the camp's dance instructor, Johnny Castle."
Creed II,2018,"Drama,Sport",7.1,130,$115.72M,"$214,215,889",66,"124,925","Under the tutelage of Rocky Balboa, newly crowned heavyweight champion Adonis Creed faces off against Viktor Drago, the son of Ivan Drago."
Smallfoot,2018,"Animation,Adventure,Comedy",6.6,96,$83.24M,"$214,115,531",60,"39,768","High up on a mountain peak surrounded by clouds, a secret Yeti society lives in peace and harmony. One day, a Yeti witnesses an airplane crash; Inside lies ""Smallfoot"", a legendary creature that will rock the society to its core."
Public Enemies,2009,"Action,Biography,Crime",7.0,140,$97.10M,"$214,104,620",70,"303,464","The Feds try to take down notorious American gangsters John Dillinger, Baby Face Nelson, and Pretty Boy Floyd during a booming crime wave in the 1930s."
The Bourne Identity,2002,"Action,Mystery,Thriller",7.9,119,$121.66M,"$214,034,224",68,"545,806","A man is picked up by a fishing boat, bullet-riddled and suffering from amnesia, before racing to elude assassins and attempting to regain his memory."
Disclosure,1994,"Drama,Thriller",6.1,128,$83.02M,"$214,015,089",58,"50,693","A computer specialist is sued for sexual harassment by a former lover turned boss who initiated the act forcefully, which threatens both his career and his personal life."
Pulp Fiction,1994,"Crime,Drama",8.9,154,$107.93M,"$213,928,762",94,"2,029,060","The lives of two mob hitmen, a boxer, a gangster and his wife, and a pair of diner bandits intertwine in four tales of violence and redemption."
The Aviator,2004,"Biography,Drama",7.5,170,$102.61M,"$213,719,942",77,"361,079",A biopic depicting the early years of legendary director and aviator Howard Hughes' career from the late 1920s to the mid 1940s.
Wo hu cang long,2000,"Action,Adventure,Drama",7.9,120,$128.08M,"$213,525,736",94,"269,385",A young Chinese warrior steals a sword from a famed swordsman and then escapes into a world of romantic adventure with a mysterious man in the frontier of the nation.
Braveheart,1995,"Biography,Drama,History",8.4,178,$75.60M,"$213,216,216",68,"1,032,016",Scottish warrior William Wallace leads his countrymen in a rebellion to free his homeland from the tyranny of King Edward I of England.
Into the Woods,2014,"Adventure,Comedy,Drama",5.9,125,$128.00M,"$212,902,372",69,"141,663",A witch tasks a childless baker and his wife with procuring magical items from classic fairy tales to reverse the curse put on their family tree.
Bedtime Stories,2008,"Adventure,Comedy,Family",6.0,99,$110.10M,"$212,874,864",33,"95,677",A hotel handyman's life changes when the lavish bedtime stories he tells his niece and nephew start to magically come true.
Miss Congeniality,2000,"Action,Comedy,Crime",6.3,109,$106.81M,"$212,742,720",43,"210,746",An F.B.I. Agent must go undercover in the Miss United States beauty pageant to prevent a group from bombing the event.
Entrapment,1999,"Action,Crime,Romance",6.3,113,$87.70M,"$212,404,396",54,"116,636",An insurance agent is sent by her employer to track down and help capture an art thief.
Ace Ventura: When Nature Calls,1995,"Adventure,Comedy,Crime",6.4,90,$108.39M,"$212,385,533",45,"218,023","Ace Ventura, Pet Detective, returns from a spiritual quest to investigate the disappearance of a rare white bat, the sacred animal of a tribe in Africa."
End of Days,1999,"Action,Fantasy,Horror",5.8,122,$66.89M,"$211,989,043",33,"111,239","At the end of the century, Satan visits New York in search of a bride. It's up to an ex-cop who now runs an elite security outfit to stop him."
Bridget Jones's Baby,2016,"Comedy,Drama,Romance",6.5,123,$24.25M,"$211,952,420",59,"76,123","Forty-something and single again, Bridget decides to focus on her job and surround herself with friends. Then she discovers that she is pregnant--but she is only 50% sure of the baby's father's identity."
Fury,2014,"Action,Drama,War",7.5,134,$85.82M,"$211,822,697",64,"486,715","A grizzled tank commander makes tough decisions as he and his crew fight their way across Germany in April, 1945."
Battle: Los Angeles,2011,"Action,Adventure,Sci-Fi",5.7,116,$83.55M,"$211,819,354",37,"180,761",A squad of U.S. Marines becomes the last line of defense against a global invasion.
Australia,2008,"Adventure,Drama,Romance",6.6,165,$49.55M,"$211,787,511",53,"125,206","Set in northern Australia before WWII, an Englishwoman who inherits a sprawling ranch reluctantly pacts with a stock-man in order to drive 2,000 head of cattle over unforgiving landscapes."
Due Date,2010,"Comedy,Drama",6.5,95,$100.54M,"$211,780,824",51,"343,897",High-strung father-to-be Peter Highman is forced to hitch a ride with aspiring actor Ethan Tremblay on a road trip in order to make it to his child's birth on time.
Master and Commander: The Far Side of the World,2003,"Action,Adventure,Drama",7.4,138,$93.93M,"$211,622,535",81,"221,838","During the Napoleonic Wars, a brash British captain pushes his ship and crew to their limits in pursuit of a formidable French war vessel around South America."
A Series of Unfortunate Events,2004,"Adventure,Comedy,Family",6.8,108,$118.63M,"$211,468,235",62,"209,564","When a massive fire kills their parents, three children are delivered to the custody of cousin and stage actor Count Olaf, who is secretly plotting to steal their parents' vast fortune."
